{
  "registryType": "blackLightFtlMathematicalCalibrationRegistry",
  "registryVersion": "1.0.0",
  "authority": {
    "primary": "docs/blacklight/BLACK_LIGHT_PROPULSION_TRANSIT_AUTHORITY.md",
    "designSource": "The different lightspeed methods (legacy design source; exact repository path currently UNRESOLVED)",
    "modelSource": "data/exo-vessel/ftl-mathematical-model-registry.json",
    "upgradeSource": "data/exo-vessel/ftl-upgrade-causality-registry.json"
  },
  "canonPolicy": {
    "formulaStatus": "DERIVED",
    "coefficientStatus": "PROPOSED",
    "exampleStatus": "PROPOSED",
    "rule": "Transit-family identities and recovered Path behavior remain authoritative. These normalized equations explain and compare that behavior. Numerical coefficients and thresholds are never canon unless separately adopted. Runtime speed/range authority remains in the existing live Path sources."
  },
  "variables": {
    "chi_g": {"meaning":"normalized external gravity/curvature severity at the drive solution","range":"0..1+; 0 benign, >=1 beyond nominal calibrated regime","status":"PROPOSED"},
    "chi_t": {"meaning":"normalized tidal/shear severity across the affected volume","range":"0..1+","status":"PROPOSED"},
    "u_r": {"meaning":"normalized route/reference uncertainty after covariance propagation","range":"0..1+","status":"DERIVED"},
    "mu_c": {"meaning":"whole-effect coverage reserve=(valid-required)/required","range":">-1; positive is spare coverage","status":"DERIVED"},
    "mu_r": {"meaning":"recovery authority reserve=(available-required)/required","range":">-1; positive is spare recovery authority","status":"DERIVED"},
    "eta_f": {"meaning":"fraction of conditioned drive-state effort producing useful family-specific transit effect","range":"0..1","status":"PROPOSED"},
    "mu_s": {"meaning":"structural support reserve against family-specific field, recoil, pressure, strain or topology load","range":">-1","status":"DERIVED"},
    "b_c": {"meaning":"normalized control bandwidth relative to fastest relevant field/environment disturbance","range":"0..1+","status":"DERIVED"},
    "epsilon": {"meaning":"usable energy/working-state reserve after required recovery reserve is protected","range":"0..1+","status":"DERIVED"},
    "i_a": {"meaning":"normalized infrastructure assistance from beacons, corridors, paired anchors or gateworks","range":"0..1","status":"PROPOSED"},
    "p_fork": {"meaning":"normalized probability/likelihood indicator of a route, topology, phase or state branch becoming ambiguous or destructive","range":"0..1","status":"DERIVED"},
    "h_abort": {"meaning":"actionable warning time or solution distance remaining before the family-specific no-abort boundary","range":">=0 in local operational units","status":"DERIVED"}
  },
  "families": [
    {
      "family":"metric-envelope",
      "physicalAction":"deform the local spacetime metric around a protected moving volume",
      "distanceModel":"effective metric geodesic; useful gain comes from reducing integrated route length in the engineered metric rather than increasing local hull velocity",
      "gravityCoupling":"external curvature consumes solution freedom and field authority; high gradients raise wall stress, horizon risk and energy burden",
      "forkRisk":"competing admissible tensor solutions or rapidly changing external curvature can force an unsafe sector solution",
      "structuralLimit":"field-wall gradients, emitter-sector support, hull deformation and coverage closure bound admissible compression",
      "abortHorizon":"last state from which envelope compression can be reduced and normal causal control/recovery retained before horizon or recovery authority is lost",
      "equations":[
        {"name":"effectiveDistance","expression":"D_M=integral_Gamma sqrt(gamma_eff_ij dx^i dx^j); G_M=D0/D_M","meaning":"route shortening generated by the engineered metric","status":"DERIVED"},
        {"name":"admissibility","expression":"A_M=eta_f*(1+mu_c)*(1+mu_r)*(1+mu_s)*b_c/[(1+chi_g)(1+chi_t)(1+u_r)]","meaning":"normalized solution quality; not a canonical threshold","status":"PROPOSED"}
      ],
      "tiers":[
        {"tier":"P0","mathematicalCapability":"small static metric perturbation in one certified geometry","mechanicalEnablers":["monumental fixed emitters","large stand-off structure"],"changedTerms":["small h_munu","high gradient penalty"],"distanceEffect":"tiny controlled shortening only","safetyEffect":"only pre-surveyed low-curvature cases","abortEffect":"abort before meaningful deformation"},
        {"tier":"P1","mathematicalCapability":"directed longitudinal compression and inertial-relief solution","mechanicalEnablers":["improved symmetry","faster timing"],"changedTerms":["G_M","eta_f"],"distanceEffect":"greater useful shortening per imposed stress","safetyEffect":"lower uncontrolled mode loss","abortEffect":"controlled ramp-down remains broad"},
        {"tier":"P2","mathematicalCapability":"closed three-dimensional moving boundary around full hull","mechanicalEnablers":["whole-hull emitters","stronger active materials","radiation recovery"],"changedTerms":["mu_c","mu_s"],"distanceEffect":"macroscopic vessel becomes transitable","safetyEffect":"coverage leakage sharply reduced","abortEffect":"abort requires maintained closure during collapse"},
        {"tier":"P3","mathematicalCapability":"horizon-constrained superluminal-equivalent metric solutions","mechanicalEnablers":["horizon sensing","higher field density","faster controls"],"changedTerms":["h_abort","b_c","G_M"],"distanceEffect":"first operational superluminal-equivalent transit","safetyEffect":"unsafe horizon-forming solutions rejected","abortEffect":"explicit commit boundary appears"},
        {"tier":"P4","mathematicalCapability":"dynamic multi-sector tensor solving under hull/cargo/environment motion","mechanicalEnablers":["distributed field sectors","fleet sensing","redundant recovery"],"changedTerms":["u_r","mu_c","b_c"],"distanceEffect":"longer stable routes and larger vessels","safetyEffect":"sector faults can be isolated","abortEffect":"sectorized degraded abort becomes possible"},
        {"tier":"P5","mathematicalCapability":"route optimization through heterogeneous gravitational terrain","mechanicalEnablers":["predictive gravimetry","strategic stores","durable field structures"],"changedTerms":["chi_g","eta_f","u_r"],"distanceEffect":"range grows by avoiding expensive curvature rather than raw compression alone","safetyEffect":"high-risk gravity terrain avoided earlier","abortEffect":"prediction expands h_abort"},
        {"tier":"P6","mathematicalCapability":"continuous receding-horizon tensor re-solving","mechanicalEnablers":["compact distributed emitters","self-calibration","rapid recovery"],"changedTerms":["b_c","eta_f","mu_r"],"distanceEffect":"high gain sustained through changing terrain","safetyEffect":"fault-tolerant adaptive envelope","abortEffect":"continuous solution rewriting preserves recovery authority longer"}
      ],
      "exampleCase":{"status":"PROPOSED","inputs":{"D0":1,"chi_g":0.35,"chi_t":0.2,"tier":"P4"},"interpretation":"A P4 metric system should choose a slightly longer geometric route if it materially lowers curvature/tidal penalties, because useful metric gain is route-integrated rather than a single local compression number."}
    },
    {
      "family":"gravitic-plane",
      "physicalAction":"couple the craft to favorable gravitational/equipotential geodesic planes and correct against gradients",
      "distanceModel":"weighted route through naturally occurring gravitational geometry",
      "gravityCoupling":"gravity is both roadway and hazard; smooth usable gradients improve transit while ridges, saddles and shear can force branching or ejection",
      "forkRisk":"two or more admissible planes can diverge faster than the controller can identify and commit to one",
      "structuralLimit":"plane-coupling force and differential gradient across the hull bound safe adherence",
      "abortHorizon":"look-ahead distance/time required to leave the plane before an unavoidable ridge, fork or gradient overload",
      "equations":[
        {"name":"routeFunctional","expression":"J_g[Gamma]=integral_Gamma [1+a_g*chi_g+a_t*chi_t+a_u*u_r+a_f*p_fork] ds; Gamma*=argmin J_g","meaning":"select the safest/most efficient usable gravity route","status":"DERIVED"},
        {"name":"planeGain","expression":"G_g=D0/integral_Gamma* ds/lambda_g(x,t)","meaning":"effective transit gain supplied by the usable plane geometry/coupling","status":"DERIVED"}
      ],
      "tiers":[
        {"tier":"P0","mathematicalCapability":"one fixed surveyed rail","mechanicalEnablers":["fixed resonators","certified mass map"],"changedTerms":["single Gamma"],"distanceEffect":"only one known lane","safetyEffect":"unknown geometry is prohibitive","abortEffect":"leave before entering uncertain section"},
        {"tier":"P1","mathematicalCapability":"continuous local equipotential following","mechanicalEnablers":["fast gradiometers","plane-control hardware"],"changedTerms":["chi_g","b_c"],"distanceEffect":"local route flexibility","safetyEffect":"small perturbations corrected","abortEffect":"local ejection warning possible"},
        {"tier":"P2","mathematicalCapability":"multi-body barycentric solution and plane switching","mechanicalEnablers":["atom interferometry","transition coils","ephemerides"],"changedTerms":["p_fork","u_r"],"distanceEffect":"complex systems traversable","safetyEffect":"frame transitions modeled","abortEffect":"switch-or-exit decisions become calculable"},
        {"tier":"P3","mathematicalCapability":"interstellar saddle/shear prediction","mechanicalEnablers":["deep gravimetry","stronger coupling"],"changedTerms":["route horizon","G_g"],"distanceEffect":"interstellar planes become useful","safetyEffect":"far-field curvature certified","abortEffect":"stellar-scale warning horizon"},